<?xml version="1.0" encoding="UTF-8"?>
<account xmlns:xsi="http://www.w3.org/2001/XMLSchema-instance" xsi:noNamespaceSchemaLocation="account.xsd"><profilo stato="attivo"><idAcc>5</idAcc><nome>cliente</nome><cognome>uno</cognome><soldi>230</soldi><crediti>200</crediti><reputazione>50</reputazione><idAddr>1</idAddr><countBan>0</countBan><dataBan>2000-01-01</dataBan></profilo><profilo stato="bannato"><idAcc>6</idAcc><nome>cliente</nome><cognome>due</cognome><soldi>40</soldi><crediti>0</crediti><reputazione>10</reputazione><idAddr>2</idAddr><countBan>1</countBan><dataBan>2019-07-02</dataBan></profilo></account>
